Sheet: Série
A1: Exemple 1: | B1: Transformation d'une séries de coordonnées entre deux systèmes de références
A3: Editez les valeurs dans les cellules jaunes pour constater les changements dans les valeurs calculées.
A4: Les codes EPSG sont décrits dans une base de données qui peut être téléchargée gratuitement: | F4: http://www.epsg.org
C7: SRC source: | D7: EPSG:4326 | E7: of:=ORG.OPENGIS.OPENOFFICE.REFERENCING.GETDESCRIPTION([.D7]) -> WGS 84
C8: SRC destination: | D8: EPSG:2984 | E8: of:=ORG.OPENGIS.OPENOFFICE.REFERENCING.GETDESCRIPTION([.D8]) -> RGNC 1991 / Lambert New Caledonia
B10: Utilisation: | C10: of:=ORG.OPENGIS.OPENOFFICE.REFERENCING.GETSCOPE([.D8]) -> Large and medium scale topographic mapping and engineering survey.
B11: Région: | C11: of:=ORG.OPENGIS.OPENOFFICE.REFERENCING.GETVALIDAREA([.D8]) -> New Caledonia - onshore and offshore. Isle de Pins, Loyalty Islands, Huon Islands, Belep archipelago, Chesterfield Islands, and Walpole.
C12: of:=ORG.OPENGIS.OPENOFFICE.REFERENCING.GETBOUNDINGBOX([.D8]) -> -17.26 | D12: 157.09 | E12: of:=ORG.GEOTOOLKIT.OPENOFFICE.REFERENCING.GETTEXTLATITUDE([.C12:.C13];"D°MM'") -> 17°16'S | F12: of:=ORG.GEOTOOLKIT.OPENOFFICE.REFERENCING.GETTEXTLONGITUDE([.D12:.D13];"D°MM'") -> 157°05'E
C13: -23.46 | D13: 173.89 | E13: 23°28'S | F13: 173°53'E
A16: Coordonnées géographiques | C16: Coordonnées sources | E16: Coordonnées destinations
A17: Latitude | B17: Longitude | C17: of:=ORG.OPENGIS.OPENOFFICE.REFERENCING.GETAXIS([.$D$7];1) -> Geodetic latitude | D17: of:=ORG.OPENGIS.OPENOFFICE.REFERENCING.GETAXIS([.$D$7];2) -> Geodetic longitude | E17: of:=ORG.OPENGIS.OPENOFFICE.REFERENCING.GETAXIS([.$D$8];1) -> Easting | F17: of:=ORG.OPENGIS.OPENOFFICE.REFERENCING.GETAXIS([.$D$8];2) -> Northing
A18: 21°35.143'S | B18: 168°06.385'E | C18: of:=ORG.GEOTOOLKIT.OPENOFFICE.REFERENCING.GETVALUEANGLE([.A18:.B23]; "D°MM.mmm") -> -21.5857166666667 | D18: 168.106416666667 | E18: of:=ORG.OPENGIS.OPENOFFICE.REFERENCING.GETTRANSFORMEDCOORDINATES([.C18:.D23];[.$D$7];[.$D$8]) -> 618118.071964584 | F18: 288978.035668459
A19: 21°35.837'S | B19: 168°06.450'E | C19: -21.5972833333333 | D19: 168.1075 | E19: 618212.979398846 | F19: 287696.008104095
A20: 20°45.422'S | B20: 167°04.388'E | C20: -20.7570333333333 | D20: 167.073133333333 | E20: 511754.560393287 | F20: 381811.315436322
A21: 20°45.629'S | B21: 167°05.599'E | C21: -20.7604833333333 | D21: 167.093316666667 | E21: 513853.71831551 | F21: 381414.791427636
A22: 20°45.521'S | B22: 167°06.336'E | C22: -20.7586833333333 | D22: 167.1056 | E22: 515134.244794807 | F22: 381605.078276532
A23: 20°46.641'S | B23: 167°07.813'E | C23: -20.77735 | D23: 167.130216666667 | E23: 517682.773079647 | F23: 379520.110202169

Sheet: Multi SRC
A1: Exemple 2: | B1: Faire correspondre deux points dont l'un utilise un SRC inconnu
A3: Problème (cas réel): Nous disposons d'une séries de points exprimés en coordonnées UTM, mais le chercheur n'a pas noté de quel système UTM il s'agit. Peut-être ignorait-il qu'il en existe une dizaine pour la seule zone 58 sud. Par chance, nous possédons aussi les coordonnées géographiques pour l'un de ces points. Nous avons énuméré dans la colonne jaune ci-dessous les codes de différents systèmes de référence des coordonnées (SRC). A l’aide d’une simple formule TRANSFORM.COORD recopiée autant de fois que nécessaire, nous avons transformé la même coordonnée géographique selon tous ces SRC. La dernière colonne calcule la distance orthodromique entre ces coordonnées transformées et la coordonnée attendue. On trouve ainsi une correspondance avec le SRC « IGN53 Maré / UTM zone 58S ».
A6: SRC source: | B6: EPSG:4326 | C6: of:=ORG.OPENGIS.OPENOFFICE.REFERENCING.GETDESCRIPTION([.B6]) -> WGS 84
A8: Coordonnées géographiques | C8: Coordonnées sources | E8: Selon SRC inconnu (présumé UTM)
A9: Latitude | B9: Longitude | C9: of:=ORG.OPENGIS.OPENOFFICE.REFERENCING.GETAXIS([.$B$6];1) -> Geodetic latitude | D9: of:=ORG.OPENGIS.OPENOFFICE.REFERENCING.GETAXIS([.$B$6];2) -> Geodetic longitude | E9: Easting (m) | F9: Northing (m)
A10: 21°35.837'S | B10: 168°06.450'E | C10: of:=ORG.GEOTOOLKIT.OPENOFFICE.REFERENCING.GETVALUEANGLE([.A10:.B10]; "D°MM.mmm") -> -21.5972833333333 | D10: 168.1075 | E10: 822023 | F10: 7608649
A15: SRC destination | E15: Coordonnées destinations
A16: Code | B16: Description | E16: of:=[.E9:.F9] -> Easting (m) | F16: Northing (m) | G16: Distance (m) | H16: Précision (m)
A17: EPSG:2995 | B17: of:=ORG.OPENGIS.OPENOFFICE.REFERENCING.GETDESCRIPTION([.A17]) -> IGN53 Mare / UTM zone 58S | E17: of:=ORG.OPENGIS.OPENOFFICE.REFERENCING.GETTRANSFORMEDCOORDINATES([.$C$10:.$D$10];[.$B$6];[.A17]) -> 822022.050132211 | F17: 7608651.34107331 | G17: of:=ORG.GEOTOOLKIT.OPENOFFICE.REFERENCING.GETORTHODROMICDISTANCE([.E17:.F17];[.E$10:.F$10];[.A17]) -> 2.52420969630687 | H17: of:=ORG.OPENGIS.OPENOFFICE.REFERENCING.GETACCURACY([.$B$6];[.A17]) -> 2
A18: EPSG:2981 | B18: of:=ORG.OPENGIS.OPENOFFICE.REFERENCING.GETDESCRIPTION([.A18]) -> IGN56 Lifou / UTM zone 58S | E18: of:=ORG.OPENGIS.OPENOFFICE.REFERENCING.GETTRANSFORMEDCOORDINATES([.$C$10:.$D$10];[.$B$6];[.A18]) -> 822077.847682829 | F18: 7608753.01222804 | G18: of:=ORG.GEOTOOLKIT.OPENOFFICE.REFERENCING.GETORTHODROMICDISTANCE([.E18:.F18];[.E$10:.F$10];[.A18]) -> 117.483874377467 | H18: of:=ORG.OPENGIS.OPENOFFICE.REFERENCING.GETACCURACY([.$B$6];[.A18]) -> 1
A19: EPSG:3060 | B19: of:=ORG.OPENGIS.OPENOFFICE.REFERENCING.GETDESCRIPTION([.A19]) -> IGN72 Grande Terre / UTM zone 58S | E19: of:=ORG.OPENGIS.OPENOFFICE.REFERENCING.GETTRANSFORMEDCOORDINATES([.$C$10:.$D$10];[.$B$6];[.A19]) -> 821435.604702611 | F19: 7608197.32290849 | G19: of:=ORG.GEOTOOLKIT.OPENOFFICE.REFERENCING.GETORTHODROMICDISTANCE([.E19:.F19];[.E$10:.F$10];[.A19]) -> 740.325114546074 | H19: of:=ORG.OPENGIS.OPENOFFICE.REFERENCING.GETACCURACY([.$B$6];[.A19]) -> 2
A20: EPSG:2998 | B20: of:=ORG.OPENGIS.OPENOFFICE.REFERENCING.GETDESCRIPTION([.A20]) -> NEA74 Noumea / UTM zone 58S | E20: of:=ORG.OPENGIS.OPENOFFICE.REFERENCING.GETTRANSFORMEDCOORDINATES([.$C$10:.$D$10];[.$B$6];[.A20]) -> 821434.138542961 | F20: 7608198.58546998 | G20: of:=ORG.GEOTOOLKIT.OPENOFFICE.REFERENCING.GETORTHODROMICDISTANCE([.E20:.F20];[.E$10:.F$10];[.A20]) -> 740.719843971172 | H20: of:=ORG.OPENGIS.OPENOFFICE.REFERENCING.GETACCURACY([.$B$6];[.A20]) -> 1
A21: EPSG:2133 | B21: of:=ORG.OPENGIS.OPENOFFICE.REFERENCING.GETDESCRIPTION([.A21]) -> NZGD2000 / UTM zone 58S | E21: of:=ORG.OPENGIS.OPENOFFICE.REFERENCING.GETTRANSFORMEDCOORDINATES([.$C$10:.$D$10];[.$B$6];[.A21]) -> 821772.306570528 | F21: 7608533.05272541 | G21: of:=ORG.GEOTOOLKIT.OPENOFFICE.REFERENCING.GETORTHODROMICDISTANCE([.E21:.F21];[.E$10:.F$10];[.A21]) -> 275.965178354192 | H21: of:=ORG.OPENGIS.OPENOFFICE.REFERENCING.GETACCURACY([.$B$6];[.A21]) -> 1
A22: EPSG:27258 | B22: of:=ORG.OPENGIS.OPENOFFICE.REFERENCING.GETDESCRIPTION([.A22]) -> NZGD49 / UTM zone 58S | E22: of:=ORG.OPENGIS.OPENOFFICE.REFERENCING.GETTRANSFORMEDCOORDINATES([.$C$10:.$D$10];[.$B$6];[.A22]) -> 821764.587557625 | F22: 7608287.70377517 | G22: of:=ORG.GEOTOOLKIT.OPENOFFICE.REFERENCING.GETORTHODROMICDISTANCE([.E22:.F22];[.E$10:.F$10];[.A22]) -> 443.80733027132 | H22: of:=ORG.OPENGIS.OPENOFFICE.REFERENCING.GETACCURACY([.$B$6];[.A22]) -> 4
A23: EPSG:2997 | B23: of:=ORG.OPENGIS.OPENOFFICE.REFERENCING.GETDESCRIPTION([.A23]) -> ST71 Belep / UTM zone 58S | E23: of:=ORG.OPENGIS.OPENOFFICE.REFERENCING.GETTRANSFORMEDCOORDINATES([.$C$10:.$D$10];[.$B$6];[.A23]) -> 821500.729926428 | F23: 7608191.43248415 | G23: of:=ORG.GEOTOOLKIT.OPENOFFICE.REFERENCING.GETORTHODROMICDISTANCE([.E23:.F23];[.E$10:.F$10];[.A23]) -> 693.748626893724 | H23: of:=ORG.OPENGIS.OPENOFFICE.REFERENCING.GETACCURACY([.$B$6];[.A23]) -> 1
A24: EPSG:2996 | B24: of:=ORG.OPENGIS.OPENOFFICE.REFERENCING.GETDESCRIPTION([.A24]) -> ST84 Ile des Pins / UTM zone 58S | E24: of:=ORG.OPENGIS.OPENOFFICE.REFERENCING.GETTRANSFORMEDCOORDINATES([.$C$10:.$D$10];[.$B$6];[.A24]) -> 821435.900619669 | F24: 7608196.76237296 | G24: of:=ORG.GEOTOOLKIT.OPENOFFICE.REFERENCING.GETORTHODROMICDISTANCE([.E24:.F24];[.E$10:.F$10];[.A24]) -> 740.432385716008 | H24: of:=ORG.OPENGIS.OPENOFFICE.REFERENCING.GETACCURACY([.$B$6];[.A24]) -> 10
A25: EPSG:2983 | B25: of:=ORG.OPENGIS.OPENOFFICE.REFERENCING.GETDESCRIPTION([.A25]) -> ST87 Ouvea / UTM zone 58S | E25: of:=ORG.OPENGIS.OPENOFFICE.REFERENCING.GETTRANSFORMEDCOORDINATES([.$C$10:.$D$10];[.$B$6];[.A25]) -> 821789.041646222 | F25: 7608441.6990401 | G25: of:=ORG.GEOTOOLKIT.OPENOFFICE.REFERENCING.GETORTHODROMICDISTANCE([.E25:.F25];[.E$10:.F$10];[.A25]) -> 312.3112879305 | H25: of:=ORG.OPENGIS.OPENOFFICE.REFERENCING.GETACCURACY([.$B$6];[.A25]) -> 1
A26: EPSG:32358 | B26: of:=ORG.OPENGIS.OPENOFFICE.REFERENCING.GETDESCRIPTION([.A26]) -> WGS 72 / UTM zone 58S | E26: of:=ORG.OPENGIS.OPENOFFICE.REFERENCING.GETTRANSFORMEDCOORDINATES([.$C$10:.$D$10];[.$B$6];[.A26]) -> 821756.177187647 | F26: 7608529.93233919 | G26: of:=ORG.GEOTOOLKIT.OPENOFFICE.REFERENCING.GETORTHODROMICDISTANCE([.E26:.F26];[.E$10:.F$10];[.A26]) -> 291.927000916971 | H26: of:=ORG.OPENGIS.OPENOFFICE.REFERENCING.GETACCURACY([.$B$6];[.A26]) -> 2
A27: EPSG:32558 | B27: of:=ORG.OPENGIS.OPENOFFICE.REFERENCING.GETDESCRIPTION([.A27]) -> WGS 72BE / UTM zone 58S | E27: of:=ORG.OPENGIS.OPENOFFICE.REFERENCING.GETTRANSFORMEDCOORDINATES([.$C$10:.$D$10];[.$B$6];[.A27]) -> 821748.741928908 | F27: 7608532.50984588 | G27: of:=ORG.GEOTOOLKIT.OPENOFFICE.REFERENCING.GETORTHODROMICDISTANCE([.E27:.F27];[.E$10:.F$10];[.A27]) -> 297.710086947727 | H27: of:=ORG.OPENGIS.OPENOFFICE.REFERENCING.GETACCURACY([.$B$6];[.A27]) -> 2
A28: EPSG:32758 | B28: of:=ORG.OPENGIS.OPENOFFICE.REFERENCING.GETDESCRIPTION([.A28]) -> WGS 84 / UTM zone 58S | E28: of:=ORG.OPENGIS.OPENOFFICE.REFERENCING.GETTRANSFORMEDCOORDINATES([.$C$10:.$D$10];[.$B$6];[.A28]) -> 821772.306600876 | F28: 7608533.0542067 | G28: of:=ORG.GEOTOOLKIT.OPENOFFICE.REFERENCING.GETORTHODROMICDISTANCE([.E28:.F28];[.E$10:.F$10];[.A28]) -> 275.96452956407 | H28: of:=ORG.OPENGIS.OPENOFFICE.REFERENCING.GETACCURACY([.$B$6];[.A28]) -> 0

Sheet: Distances
A1: Exemple 3: | B1: Calculs de distances orthodromiques
A3: Cet exemple calcule des distances à partir du méridien central d'une projection UTM. Elles sont estimées d’après la relation de Pythagore (sujette aux déformations induites par la projection cartographique) et d’après un calcul de distance orthodromique (plus précis). La différence est calculée en utilisant la distance orthodromique comme référence. Cet exemple montre que l’erreur d’une distance calculée par la relation de Pythagore est faible tant que l’on reste à l’intérieur d’une zone UTM, et s’accroît à mesure que l’on s’éloigne. Les valeurs en rouge sont en dehors de la zone UTM (rappel: ces zones n'ont « que » 6° de largeur).
A6: SRC: | B6: EPSG:32758 | C6: of:=ORG.OPENGIS.OPENOFFICE.REFERENCING.GETDESCRIPTION([.B6]) -> WGS 84 / UTM zone 58S
A9: False Easting | B9: False Northing
A10: of:=ORG.OPENGIS.OPENOFFICE.REFERENCING.GETPARAMETER([.$B$6];[.A9]) -> 500000 | B10: of:=ORG.OPENGIS.OPENOFFICE.REFERENCING.GETPARAMETER([.$B$6];[.B9]) -> 10000000
C11: Distance (km)
A12: of:=ORG.OPENGIS.OPENOFFICE.REFERENCING.GETAXIS([.$B$6];1) -> Easting | B12: of:=ORG.OPENGIS.OPENOFFICE.REFERENCING.GETAXIS([.$B$6];2) -> Northing | C12: Cartésienne | D12: Orthodromique | E12: Différence
A13: of:=[.A10] -> 500000 | B13: of:=[.B10] -> 10000000 | C13: of:=SQRT(SUMXMY2([.A13:.B13];[.A$10:.B$10]))/1000 -> 0 | D13: of:=ORG.GEOTOOLKIT.OPENOFFICE.REFERENCING.GETORTHODROMICDISTANCE([.A13:.B81];[.A$10:.B$10];[.B$6])/1000 -> 0 | E13: of:=ABS([.C13]-[.D13])/[.D13] -> 0
A14: of:=[.A13]+50000 -> 550000 | B14: of:=[.B13]+100000 -> 10100000 | C14: of:=SQRT(SUMXMY2([.A14:.B14];[.A$10:.B$10]))/1000 -> 111.80339887499 | D14: 111.846983896085 | E14: of:=ABS([.C14]-[.D14])/[.D14] -> 0.000389684366779573
A15: of:=[.A14]+50000 -> 600000 | B15: of:=[.B14]+100000 -> 10200000 | C15: of:=SQRT(SUMXMY2([.A15:.B15];[.A$10:.B$10]))/1000 -> 223.606797749979 | D15: 223.687042409609 | E15: of:=ABS([.C15]-[.D15])/[.D15] -> 0.000358736289620771
A16: of:=[.A15]+50000 -> 650000 | B16: of:=[.B15]+100000 -> 10300000 | C16: of:=SQRT(SUMXMY2([.A16:.B16];[.A$10:.B$10]))/1000 -> 335.410196624968 | D16: 335.513250280283 | E16: of:=ABS([.C16]-[.D16])/[.D16] -> 0.000307152266649952
A17: of:=[.A16]+50000 -> 700000 | B17: of:=[.B16]+100000 -> 10400000 | C17: of:=SQRT(SUMXMY2([.A17:.B17];[.A$10:.B$10]))/1000 -> 447.213595499958 | D17: 447.318682490314 | E17: of:=ABS([.C17]-[.D17])/[.D17] -> 0.000234926450581911
A18: of:=[.A17]+50000 -> 750000 | B18: of:=[.B17]+100000 -> 10500000 | C18: of:=SQRT(SUMXMY2([.A18:.B18];[.A$10:.B$10]))/1000 -> 559.016994374947 | D18: 559.096414380552 | E18: of:=ABS([.C18]-[.D18])/[.D18] -> 0.000142050643792212
A19: of:=[.A18]+50000 -> 800000 | B19: of:=[.B18]+100000 -> 10600000 | C19: of:=SQRT(SUMXMY2([.A19:.B19];[.A$10:.B$10]))/1000 -> 670.820393249937 | D19: 670.839521760522 | E19: of:=ABS([.C19]-[.D19])/[.D19] -> 0.0000285142868963533
A20: of:=[.A19]+50000 -> 850000 | B20: of:=[.B19]+100000 -> 10700000 | C20: of:=SQRT(SUMXMY2([.A20:.B20];[.A$10:.B$10]))/1000 -> 782.623792124926 | D20: 782.541081010335 | E20: of:=ABS([.C20]-[.D20])/[.D20] -> 0.000105695555924902
A21: of:=[.A20]+50000 -> 900000 | B21: of:=[.B20]+100000 -> 10800000 | C21: of:=SQRT(SUMXMY2([.A21:.B21];[.A$10:.B$10]))/1000 -> 894.427190999916 | D21: 894.194169172451 | E21: of:=ABS([.C21]-[.D21])/[.D21] -> 0.000260594214879008
A22: of:=[.A21]+50000 -> 950000 | B22: of:=[.B21]+100000 -> 10900000 | C22: of:=SQRT(SUMXMY2([.A22:.B22];[.A$10:.B$10]))/1000 -> 1006.23058987491 | D22: 1005.79186403134 | E22: of:=ABS([.C22]-[.D22])/[.D22] -> 0.000436199435745864
A23: of:=[.A22]+50000 -> 1000000 | B23: of:=[.B22]+100000 -> 11000000 | C23: of:=SQRT(SUMXMY2([.A23:.B23];[.A$10:.B$10]))/1000 -> 1118.0339887499 | D23: 1117.32724417901 | E23: of:=ABS([.C23]-[.D23])/[.D23] -> 0.000632531404352977
A24: of:=[.A23]+50000 -> 1050000 | B24: of:=[.B23]+100000 -> 11100000 | C24: of:=SQRT(SUMXMY2([.A24:.B24];[.A$10:.B$10]))/1000 -> 1229.83738762488 | D24: 1228.79338906455 | E24: of:=ABS([.C24]-[.D24])/[.D24] -> 0.000849612774304189
A25: of:=[.A24]+50000 -> 1100000 | B25: of:=[.B24]+100000 -> 11200000 | C25: of:=SQRT(SUMXMY2([.A25:.B25];[.A$10:.B$10]))/1000 -> 1341.64078649987 | D25: 1340.18337902558 | E25: of:=ABS([.C25]-[.D25])/[.D25] -> 0.00108746869801902
A26: of:=[.A25]+50000 -> 1150000 | B26: of:=[.B25]+100000 -> 11300000 | C26: of:=SQRT(SUMXMY2([.A26:.B26];[.A$10:.B$10]))/1000 -> 1453.44418537486 | D26: 1451.49029529975 | E26: of:=ABS([.C26]-[.D26])/[.D26] -> 0.00134612686108877
A27: of:=[.A26]+50000 -> 1200000 | B27: of:=[.B26]+100000 -> 11400000 | C27: of:=SQRT(SUMXMY2([.A27:.B27];[.A$10:.B$10]))/1000 -> 1565.24758424985 | D27: 1562.70722001433 | E27: of:=ABS([.C27]-[.D27])/[.D27] -> 0.00162561752002216
A28: of:=[.A27]+50000 -> 1250000 | B28: of:=[.B27]+100000 -> 11500000 | C28: of:=SQRT(SUMXMY2([.A28:.B28];[.A$10:.B$10]))/1000 -> 1677.05098312484 | D28: 1673.82723615167 | E28: of:=ABS([.C28]-[.D28])/[.D28] -> 0.00192597354347
A29: of:=[.A28]+50000 -> 1300000 | B29: of:=[.B28]+100000 -> 11600000 | C29: of:=SQRT(SUMXMY2([.A29:.B29];[.A$10:.B$10]))/1000 -> 1788.85438199983 | D29: 1784.84342748852 | E29: of:=ABS([.C29]-[.D29])/[.D29] -> 0.00224723045704532
A30: of:=[.A29]+50000 -> 1350000 | B30: of:=[.B29]+100000 -> 11700000 | C30: of:=SQRT(SUMXMY2([.A30:.B30];[.A$10:.B$10]))/1000 -> 1900.65778087482 | D30: 1895.74887850687 | E30: of:=ABS([.C30]-[.D30])/[.D30] -> 0.00258942649187669
A31: of:=[.A30]+50000 -> 1400000 | B31: of:=[.B30]+100000 -> 11800000 | C31: of:=SQRT(SUMXMY2([.A31:.B31];[.A$10:.B$10]))/1000 -> 2012.46117974981 | D31: 2006.53667427285 | E31: of:=ABS([.C31]-[.D31])/[.D31] -> 0.00295260263763243
A32: of:=[.A31]+50000 -> 1450000 | B32: of:=[.B31]+100000 -> 11900000 | C32: of:=SQRT(SUMXMY2([.A32:.B32];[.A$10:.B$10]))/1000 -> 2124.2645786248 | D32: 2117.19990028262 | E32: of:=ABS([.C32]-[.D32])/[.D32] -> 0.00333680269928283
A33: of:=[.A32]+50000 -> 1500000 | B33: of:=[.B32]+100000 -> 12000000 | C33: of:=SQRT(SUMXMY2([.A33:.B33];[.A$10:.B$10]))/1000 -> 2236.06797749979 | D33: 2227.73164226863 | E33: of:=ABS([.C33]-[.D33])/[.D33] -> 0.00374207335973051
A34: of:=[.A33]+50000 -> 1550000 | B34: of:=[.B33]+100000 -> 12100000 | C34: of:=SQRT(SUMXMY2([.A34:.B34];[.A$10:.B$10]))/1000 -> 2347.87137637478 | D34: 2338.12498596338 | E34: of:=ABS([.C34]-[.D34])/[.D34] -> 0.00416846424802292
A35: of:=[.A34]+50000 -> 1600000 | B35: of:=[.B34]+100000 -> 12200000 | C35: of:=SQRT(SUMXMY2([.A35:.B35];[.A$10:.B$10]))/1000 -> 2459.67477524977 | D35: 2448.37301681357 | E35: of:=ABS([.C35]-[.D35])/[.D35] -> 0.00461602801476384
A36: of:=[.A35]+50000 -> 1650000 | B36: of:=[.B35]+100000 -> 12300000 | C36: of:=SQRT(SUMXMY2([.A36:.B36];[.A$10:.B$10]))/1000 -> 2571.47817412476 | D36: 2558.46881963599 | E36: of:=ABS([.C36]-[.D36])/[.D36] -> 0.00508482041638501
A37: of:=[.A36]+50000 -> 1700000 | B37: of:=[.B36]+100000 -> 12400000 | C37: of:=SQRT(SUMXMY2([.A37:.B37];[.A$10:.B$10]))/1000 -> 2683.28157299975 | D37: 2668.40547820367 | E37: of:=ABS([.C37]-[.D37])/[.D37] -> 0.00557490041059747
A38: of:=[.A37]+50000 -> 1750000 | B38: of:=[.B37]+100000 -> 12500000 | C38: of:=SQRT(SUMXMY2([.A38:.B38];[.A$10:.B$10]))/1000 -> 2795.08497187474 | D38: 2778.17607474575 | E38: of:=ABS([.C38]-[.D38])/[.D38] -> 0.00608633026635469
A39: of:=[.A38]+50000 -> 1800000 | B39: of:=[.B38]+100000 -> 12600000 | C39: of:=SQRT(SUMXMY2([.A39:.B39];[.A$10:.B$10]))/1000 -> 2906.88837074973 | D39: 2887.77368933863 | E39: of:=ABS([.C39]-[.D39])/[.D39] -> 0.00661917569290999
A40: of:=[.A39]+50000 -> 1850000 | B40: of:=[.B39]+100000 -> 12700000 | C40: of:=SQRT(SUMXMY2([.A40:.B40];[.A$10:.B$10]))/1000 -> 3018.69176962472 | D40: 2997.19139915655 | E40: of:=ABS([.C40]-[.D40])/[.D40] -> 0.00717350599438541
A41: of:=[.A40]+50000 -> 1900000 | B41: of:=[.B40]+100000 -> 12800000 | C41: of:=SQRT(SUMXMY2([.A41:.B41];[.A$10:.B$10]))/1000 -> 3130.49516849971 | D41: 3106.42227753693 | E41: of:=ABS([.C41]-[.D41])/[.D41] -> 0.00774939425874284
A42: of:=[.A41]+50000 -> 1950000 | B42: of:=[.B41]+100000 -> 12900000 | C42: of:=SQRT(SUMXMY2([.A42:.B42];[.A$10:.B$10]))/1000 -> 3242.2985673747 | D42: 3215.45939279773 | E42: of:=ABS([.C42]-[.D42])/[.D42] -> 0.00834691759351101
A43: of:=[.A42]+50000 -> 2000000 | B43: of:=[.B42]+100000 -> 13000000 | C43: of:=SQRT(SUMXMY2([.A43:.B43];[.A$10:.B$10]))/1000 -> 3354.10196624968 | D43: 3324.29580671813 | E43: of:=ABS([.C43]-[.D43])/[.D43] -> 0.00896615742537753
A44: of:=[.A43]+50000 -> 2050000 | B44: of:=[.B43]+100000 -> 13100000 | C44: of:=SQRT(SUMXMY2([.A44:.B44];[.A$10:.B$10]))/1000 -> 3465.90536512467 | D44: 3432.92457255788 | E44: of:=ABS([.C44]-[.D44])/[.D44] -> 0.00960719988736156
A45: of:=[.A44]+50000 -> 2100000 | B45: of:=[.B44]+100000 -> 13200000 | C45: of:=SQRT(SUMXMY2([.A45:.B45];[.A$10:.B$10]))/1000 -> 3577.70876399966 | D45: 3541.33873243936 | E45: of:=ABS([.C45]-[.D45])/[.D45] -> 0.0102701363264534
A46: of:=[.A45]+50000 -> 2150000 | B46: of:=[.B45]+100000 -> 13300000 | C46: of:=SQRT(SUMXMY2([.A46:.B46];[.A$10:.B$10]))/1000 -> 3689.51216287465 | D46: 3649.53131384461 | E46: of:=ABS([.C46]-[.D46])/[.D46] -> 0.0109550639772217
A47: of:=[.A46]+50000 -> 2200000 | B47: of:=[.B46]+100000 -> 13400000 | C47: of:=SQRT(SUMXMY2([.A47:.B47];[.A$10:.B$10]))/1000 -> 3801.31556174964 | D47: 3757.49532487812 | E47: of:=ABS([.C47]-[.D47])/[.D47] -> 0.0116620868644581
A48: of:=[.A47]+50000 -> 2250000 | B48: of:=[.B47]+100000 -> 13500000 | C48: of:=SQRT(SUMXMY2([.A48:.B48];[.A$10:.B$10]))/1000 -> 3913.11896062463 | D48: 3865.22374780332 | E48: of:=ABS([.C48]-[.D48])/[.D48] -> 0.0123913170223403
A49: of:=[.A48]+50000 -> 2300000 | B49: of:=[.B48]+100000 -> 13600000 | C49: of:=SQRT(SUMXMY2([.A49:.B49];[.A$10:.B$10]))/1000 -> 4024.92235949962 | D49: 3972.70953015964 | E49: of:=ABS([.C49]-[.D49])/[.D49] -> 0.0131428761513014
A50: of:=[.A49]+50000 -> 2350000 | B50: of:=[.B49]+100000 -> 13700000 | C50: of:=SQRT(SUMXMY2([.A50:.B50];[.A$10:.B$10]))/1000 -> 4136.72575837461 | D50: 4079.94557248254 | E50: of:=ABS([.C50]-[.D50])/[.D50] -> 0.0139168978809503
A51: of:=[.A50]+50000 -> 2400000 | B51: of:=[.B50]+100000 -> 13800000 | C51: of:=SQRT(SUMXMY2([.A51:.B51];[.A$10:.B$10]))/1000 -> 4248.5291572496 | D51: 4186.92471124835 | E51: of:=ABS([.C51]-[.D51])/[.D51] -> 0.0147135308728497
A52: of:=[.A51]+50000 -> 2450000 | B52: of:=[.B51]+100000 -> 13900000 | C52: of:=SQRT(SUMXMY2([.A52:.B52];[.A$10:.B$10]))/1000 -> 4360.33255612459 | D52: 4293.63969509904 | E52: of:=ABS([.C52]-[.D52])/[.D52] -> 0.0155329430882797
A53: of:=[.A52]+50000 -> 2500000 | B53: of:=[.B52]+100000 -> 14000000 | C53: of:=SQRT(SUMXMY2([.A53:.B53];[.A$10:.B$10]))/1000 -> 4472.13595499958 | D53: 4400.08315159995 | E53: of:=ABS([.C53]-[.D53])/[.D53] -> 0.0163753276738484
A54: of:=[.A53]+50000 -> 2550000 | B54: of:=[.B53]+100000 -> 14100000 | C54: of:=SQRT(SUMXMY2([.A54:.B54];[.A$10:.B$10]))/1000 -> 4583.93935387457 | D54: 4506.24754064805 | E54: of:=ABS([.C54]-[.D54])/[.D54] -> 0.0172409110963644
A55: of:=[.A54]+50000 -> 2600000 | B55: of:=[.B54]+100000 -> 14200000 | C55: of:=SQRT(SUMXMY2([.A55:.B55];[.A$10:.B$10]))/1000 -> 4695.74275274956 | D55: 4612.12508903572 | E55: of:=ABS([.C55]-[.D55])/[.D55] -> 0.0181299644089497
A56: of:=[.A55]+50000 -> 2650000 | B56: of:=[.B55]+100000 -> 14300000 | C56: of:=SQRT(SUMXMY2([.A56:.B56];[.A$10:.B$10]))/1000 -> 4807.54615162455 | D56: 4717.70769838389 | E56: of:=ABS([.C56]-[.D56])/[.D56] -> 0.0190428188824488
A57: of:=[.A56]+50000 -> 2700000 | B57: of:=[.B56]+100000 -> 14400000 | C57: of:=SQRT(SUMXMY2([.A57:.B57];[.A$10:.B$10]))/1000 -> 4919.34955049954 | D57: 4822.98681539472 | E57: of:=ABS([.C57]-[.D57])/[.D57] -> 0.0199798877320656
A58: of:=[.A57]+50000 -> 2750000 | B58: of:=[.B57]+100000 -> 14500000 | C58: of:=SQRT(SUMXMY2([.A58:.B58];[.A$10:.B$10]))/1000 -> 5031.15294937453 | D58: 4927.95324871733 | E58: of:=ABS([.C58]-[.D58])/[.D58] -> 0.0209416963693928
A59: of:=[.A58]+50000 -> 2800000 | B59: of:=[.B58]+100000 -> 14600000 | C59: of:=SQRT(SUMXMY2([.A59:.B59];[.A$10:.B$10]))/1000 -> 5142.95634824952 | D59: 5032.59691006104 | E59: of:=ABS([.C59]-[.D59])/[.D59] -> 0.0219289246011042
A60: of:=[.A59]+50000 -> 2850000 | B60: of:=[.B59]+100000 -> 14700000 | C60: of:=SQRT(SUMXMY2([.A60:.B60];[.A$10:.B$10]))/1000 -> 5254.75974712451 | D60: 5136.90644764594 | E60: of:=ABS([.C60]-[.D60])/[.D60] -> 0.0229424656025373
A61: of:=[.A60]+50000 -> 2900000 | B61: of:=[.B60]+100000 -> 14800000 | C61: of:=SQRT(SUMXMY2([.A61:.B61];[.A$10:.B$10]))/1000 -> 5366.56314599949 | D61: 5240.86872636907 | E61: of:=ABS([.C61]-[.D61])/[.D61] -> 0.0239835084969797
A62: of:=[.A61]+50000 -> 2950000 | B62: of:=[.B61]+100000 -> 14900000 | C62: of:=SQRT(SUMXMY2([.A62:.B62];[.A$10:.B$10]))/1000 -> 5478.36654487449 | D62: 5344.4680893175 | E62: of:=ABS([.C62]-[.D62])/[.D62] -> 0.0250536542307393
A63: of:=[.A62]+50000 -> 3000000 | B63: of:=[.B62]+100000 -> 15000000 | C63: of:=SQRT(SUMXMY2([.A63:.B63];[.A$10:.B$10]))/1000 -> 5590.16994374947 | D63: 5447.68530674988 | E63: of:=ABS([.C63]-[.D63])/[.D63] -> 0.0261550785290501
A64: of:=[.A63]+50000 -> 3050000 | B64: of:=[.B63]+100000 -> 15100000 | C64: of:=SQRT(SUMXMY2([.A64:.B64];[.A$10:.B$10]))/1000 -> 5701.97334262446 | D64: 5550.49607740496 | E64: of:=ABS([.C64]-[.D64])/[.D64] -> 0.0272907616016774
A65: of:=[.A64]+50000 -> 3100000 | B65: of:=[.B64]+100000 -> 15200000 | C65: of:=SQRT(SUMXMY2([.A65:.B65];[.A$10:.B$10]))/1000 -> 5813.77674149945 | D65: 5652.86888712932 | E65: of:=ABS([.C65]-[.D65])/[.D65] -> 0.0284648127495923
A66: of:=[.A65]+50000 -> 3150000 | B66: of:=[.B65]+100000 -> 15300000 | C66: of:=SQRT(SUMXMY2([.A66:.B66];[.A$10:.B$10]))/1000 -> 5925.58014037444 | D66: 5754.76194276443 | E66: of:=ABS([.C66]-[.D66])/[.D66] -> 0.0296829302947605
A67: of:=[.A66]+50000 -> 3200000 | B67: of:=[.B66]+100000 -> 15400000 | C67: of:=SQRT(SUMXMY2([.A67:.B67];[.A$10:.B$10]))/1000 -> 6037.38353924943 | D67: 5856.11877240508 | E67: of:=ABS([.C67]-[.D67])/[.D67] -> 0.0309530550675472
A68: of:=[.A67]+50000 -> 3250000 | B68: of:=[.B67]+100000 -> 15500000 | C68: of:=SQRT(SUMXMY2([.A68:.B68];[.A$10:.B$10]))/1000 -> 6149.18693812442 | D68: 5956.86189810049 | E68: of:=ABS([.C68]-[.D68])/[.D68] -> 0.0322863016322835
A69: of:=[.A68]+50000 -> 3300000 | B69: of:=[.B68]+100000 -> 15600000 | C69: of:=SQRT(SUMXMY2([.A69:.B69];[.A$10:.B$10]))/1000 -> 6260.99033699941 | D69: 6056.88371693643 | E69: of:=ABS([.C69]-[.D69])/[.D69] -> 0.0336982893517097
A70: of:=[.A69]+50000 -> 3350000 | B70: of:=[.B69]+100000 -> 15700000 | C70: of:=SQRT(SUMXMY2([.A70:.B70];[.A$10:.B$10]))/1000 -> 6372.7937358744 | D70: 6156.03333235612 | E70: of:=ABS([.C70]-[.D70])/[.D70] -> 0.0352110509829425
A71: of:=[.A70]+50000 -> 3400000 | B71: of:=[.B70]+100000 -> 15800000 | C71: of:=SQRT(SUMXMY2([.A71:.B71];[.A$10:.B$10]))/1000 -> 6484.59713474939 | D71: 6254.09750423088 | E71: of:=ABS([.C71]-[.D71])/[.D71] -> 0.0368557782098189
A72: of:=[.A71]+50000 -> 3450000 | B72: of:=[.B71]+100000 -> 15900000 | C72: of:=SQRT(SUMXMY2([.A72:.B72];[.A$10:.B$10]))/1000 -> 6596.40053362438 | D72: 6350.77305693975 | E72: of:=ABS([.C72]-[.D72])/[.D72] -> 0.0386767838312566
A73: of:=[.A72]+50000 -> 3500000 | B73: of:=[.B72]+100000 -> 16000000 | C73: of:=SQRT(SUMXMY2([.A73:.B73];[.A$10:.B$10]))/1000 -> 6708.20393249937 | D73: 6445.62689862666 | E73: of:=ABS([.C73]-[.D73])/[.D73] -> 0.0407372375103901
A74: of:=[.A73]+50000 -> 3550000 | B74: of:=[.B73]+100000 -> 16100000 | C74: of:=SQRT(SUMXMY2([.A74:.B74];[.A$10:.B$10]))/1000 -> 6820.00733137436 | D74: 6538.03814221577 | E74: of:=ABS([.C74]-[.D74])/[.D74] -> 0.0431274922270534
A75: of:=[.A74]+50000 -> 3600000 | B75: of:=[.B74]+100000 -> 16200000 | C75: of:=SQRT(SUMXMY2([.A75:.B75];[.A$10:.B$10]))/1000 -> 6931.81073024935 | D75: 6627.11457327199 | E75: of:=ABS([.C75]-[.D75])/[.D75] -> 0.0459771977092775
A76: of:=[.A75]+50000 -> 3650000 | B76: of:=[.B75]+100000 -> 16300000 | C76: of:=SQRT(SUMXMY2([.A76:.B76];[.A$10:.B$10]))/1000 -> 7043.61412912434 | D76: 6711.5728925346 | E76: of:=ABS([.C76]-[.D76])/[.D76] -> 0.0494729390422143
A77: of:=[.A76]+50000 -> 3700000 | B77: of:=[.B76]+100000 -> 16400000 | C77: of:=SQRT(SUMXMY2([.A77:.B77];[.A$10:.B$10]))/1000 -> 7155.41752799933 | D77: 6789.5691940506 | E77: of:=ABS([.C77]-[.D77])/[.D77] -> 0.0538838803306256
A78: of:=[.A77]+50000 -> 3750000 | B78: of:=[.B77]+100000 -> 16500000 | C78: of:=SQRT(SUMXMY2([.A78:.B78];[.A$10:.B$10]))/1000 -> 7267.22092687432 | D78: 6858.4646369922 | E78: of:=ABS([.C78]-[.D78])/[.D78] -> 0.059598804035152
A79: of:=[.A78]+50000 -> 3800000 | B79: of:=[.B78]+100000 -> 16600000 | C79: of:=SQRT(SUMXMY2([.A79:.B79];[.A$10:.B$10]))/1000 -> 7379.02432574931 | D79: 6914.51607561596 | E79: of:=ABS([.C79]-[.D79])/[.D79] -> 0.0671787070929572
A80: of:=[.A79]+50000 -> 3850000 | B80: of:=[.B79]+100000 -> 16700000 | C80: of:=SQRT(SUMXMY2([.A80:.B80];[.A$10:.B$10]))/1000 -> 7490.8277246243 | D80: 6952.50594675713 | E80: of:=ABS([.C80]-[.D80])/[.D80] -> 0.0774284527031954
A81: of:=[.A80]+50000 -> 3900000 | B81: of:=[.B80]+100000 -> 16800000 | C81: of:=SQRT(SUMXMY2([.A81:.B81];[.A$10:.B$10]))/1000 -> 7602.63112349929 | D81: 6965.40615446528 | E81: of:=ABS([.C81]-[.D81])/[.D81] -> 0.0914842515860327